{
  "artifactVersion": "s12.dense-hard.candidate.v4",
  "status": "FROZEN_SOURCE_ONLY_CANDIDATE",
  "datasetKind": "SYNTHETIC_NON_PRODUCTION",
  "sourceOnly": true,
  "model": {
    "id": "gpt-5.6-luna",
    "reasoningEffort": "high",
    "calls": 32
  },
  "providerCalls": 0,
  "bindings": {
    "sourcePayloadDigest": "sha256:e2d2b40a58d6b7e9a8ec50fed6fbd7ff0304c0b5da976df666cfdfc7416f5711",
    "protocolDigest": "sha256:1c44e28898ef3c27265a0f9340e4205ed8c54dde7238b5040bad941afea501f1",
    "evaluatorContractDigest": "sha256:9c9f99879dfa14fde50a7bb56fbd9bf50454406f634eefaf4aad5f6385562d47",
    "goldDigest": null,
    "manifestDigest": null
  },
  "records": [
    {
      "caseId": "dh4-001",
      "scenarioId": "dh4-s-001",
      "sourceDigest": "sha256:168204dedaee2fff910548990e55cb7448eb97a7fa19e5492d8c01834c27dea9",
      "entities": [
        {
          "occurrenceId": "dh4-001-e01",
          "type": "System",
          "label": "Alder matrix",
          "evidence": {
            "startOffset": 0,
            "endOffset": 12,
            "text": "Alder matrix"
          }
        },
        {
          "occurrenceId": "dh4-001-e02",
          "type": "Control",
          "label": "copper gate",
          "evidence": {
            "startOffset": 22,
            "endOffset": 33,
            "text": "copper gate"
          }
        },
        {
          "occurrenceId": "dh4-001-e03",
          "type": "Document",
          "label": "dune ledger",
          "evidence": {
            "startOffset": 57,
            "endOffset": 68,
            "text": "dune ledger"
          }
        }
      ],
      "relations": [
        {
          "predicate": "requires",
          "sourceOccurrenceId": "dh4-001-e01",
          "targetOccurrenceId": "dh4-001-e02",
          "triggerEvidence": {
            "startOffset": 0,
            "endOffset": 34,
            "text": "Alder matrix requires copper gate."
          }
        },
        {
          "predicate": "validates",
          "sourceOccurrenceId": "dh4-001-e02",
          "targetOccurrenceId": "dh4-001-e03",
          "triggerEvidence": {
            "startOffset": 35,
            "endOffset": 69,
            "text": "copper gate validates dune ledger."
          }
        }
      ],
      "abstention": "none",
      "quarantine": [],
      "uncertainty": []
    },
    {
      "caseId": "dh4-002",
      "scenarioId": "dh4-s-002",
      "sourceDigest": "sha256:12eaceaebd152536c232bd13df4cf0274078c2b00914617f6a5d35cf03e973c4",
      "entities": [
        {
          "occurrenceId": "dh4-002-e01",
          "type": "System",
          "label": "Bracken service",
          "evidence": {
            "startOffset": 0,
            "endOffset": 15,
            "text": "Bracken service"
          }
        },
        {
          "occurrenceId": "dh4-002-e02",
          "type": "Constraint",
          "label": "violet rule",
          "evidence": {
            "startOffset": 27,
            "endOffset": 38,
            "text": "violet rule"
          }
        },
        {
          "occurrenceId": "dh4-002-e03",
          "type": "Resource",
          "label": "summit route",
          "evidence": {
            "startOffset": 63,
            "endOffset": 75,
            "text": "summit route"
          }
        }
      ],
      "relations": [
        {
          "predicate": "implements",
          "sourceOccurrenceId": "dh4-002-e01",
          "targetOccurrenceId": "dh4-002-e02",
          "triggerEvidence": {
            "startOffset": 0,
            "endOffset": 39,
            "text": "Bracken service implements violet rule."
          }
        },
        {
          "predicate": "constrains",
          "sourceOccurrenceId": "dh4-002-e02",
          "targetOccurrenceId": "dh4-002-e03",
          "triggerEvidence": {
            "startOffset": 40,
            "endOffset": 76,
            "text": "violet rule constrains summit route."
          }
        }
      ],
      "abstention": "none",
      "quarantine": [],
      "uncertainty": []
    },
    {
      "caseId": "dh4-003",
      "scenarioId": "dh4-s-003",
      "sourceDigest": "sha256:62da824005a76fea8778ad4228aa2c87f676c19ed483d69af3f5901430c6a664",
      "entities": [
        {
          "occurrenceId": "dh4-003-e01",
          "type": "Document",
          "label": "Cobalt register",
          "evidence": {
            "startOffset": 0,
            "endOffset": 15,
            "text": "Cobalt register"
          }
        },
        {
          "occurrenceId": "dh4-003-e02",
          "type": "Requirement",
          "label": "linen request",
          "evidence": {
            "startOffset": 23,
            "endOffset": 36,
            "text": "linen request"
          }
        },
        {
          "occurrenceId": "dh4-003-e03",
          "type": "Resource",
          "label": "brittle export",
          "evidence": {
            "startOffset": 59,
            "endOffset": 73,
            "text": "brittle export"
          }
        }
      ],
      "relations": [
        {
          "predicate": "tracks",
          "sourceOccurrenceId": "dh4-003-e01",
          "targetOccurrenceId": "dh4-003-e02",
          "triggerEvidence": {
            "startOffset": 0,
            "endOffset": 37,
            "text": "Cobalt register tracks linen request."
          }
        },
        {
          "predicate": "blocks",
          "sourceOccurrenceId": "dh4-003-e02",
          "targetOccurrenceId": "dh4-003-e03",
          "triggerEvidence": {
            "startOffset": 38,
            "endOffset": 74,
            "text": "linen request blocks brittle export."
          }
        }
      ],
      "abstention": "none",
      "quarantine": [],
      "uncertainty": []
    },
    {
      "caseId": "dh4-004",
      "scenarioId": "dh4-s-004",
      "sourceDigest": "sha256:e31985ec316b59641e6897c52ad3c1900267010f5ca7acdd1a3defa25dc59606",
      "entities": [
        {
          "occurrenceId": "dh4-004-e01",
          "type": "Document",
          "label": "Drift memo",
          "evidence": {
            "startOffset": 0,
            "endOffset": 10,
            "text": "Drift memo"
          }
        },
        {
          "occurrenceId": "dh4-004-e02",
          "type": "Decision",
          "label": "amber decision",
          "evidence": {
            "startOffset": 20,
            "endOffset": 34,
            "text": "amber decision"
          }
        },
        {
          "occurrenceId": "dh4-004-e03",
          "type": "Requirement",
          "label": "ferry permit",
          "evidence": {
            "startOffset": 60,
            "endOffset": 72,
            "text": "ferry permit"
          }
        }
      ],
      "relations": [
        {
          "predicate": "contains",
          "sourceOccurrenceId": "dh4-004-e01",
          "targetOccurrenceId": "dh4-004-e02",
          "triggerEvidence": {
            "startOffset": 0,
            "endOffset": 35,
            "text": "Drift memo contains amber decision."
          }
        },
        {
          "predicate": "supports",
          "sourceOccurrenceId": "dh4-004-e02",
          "targetOccurrenceId": "dh4-004-e03",
          "triggerEvidence": {
            "startOffset": 36,
            "endOffset": 73,
            "text": "amber decision supports ferry permit."
          }
        }
      ],
      "abstention": "none",
      "quarantine": [],
      "uncertainty": []
    },
    {
      "caseId": "dh4-005",
      "scenarioId": "dh4-s-005",
      "sourceDigest": "sha256:770caa528fb567de0b56867826505d16a9777a084f0d2fe8f50d13984dd437b0",
      "entities": [
        {
          "occurrenceId": "dh4-005-e01",
          "type": "Project",
          "label": "Ember project",
          "evidence": {
            "startOffset": 0,
            "endOffset": 13,
            "text": "Ember project"
          }
        },
        {
          "occurrenceId": "dh4-005-e02",
          "type": "Dataset",
          "label": "olive dataset",
          "evidence": {
            "startOffset": 25,
            "endOffset": 38,
            "text": "olive dataset"
          }
        },
        {
          "occurrenceId": "dh4-005-e03",
          "type": "Question",
          "label": "harbor question",
          "evidence": {
            "startOffset": 62,
            "endOffset": 77,
            "text": "harbor question"
          }
        }
      ],
      "relations": [
        {
          "predicate": "dependsOn",
          "sourceOccurrenceId": "dh4-005-e01",
          "targetOccurrenceId": "dh4-005-e02",
          "triggerEvidence": {
            "startOffset": 0,
            "endOffset": 39,
            "text": "Ember project depends on olive dataset."
          }
        },
        {
          "predicate": "answers",
          "sourceOccurrenceId": "dh4-005-e02",
          "targetOccurrenceId": "dh4-005-e03",
          "triggerEvidence": {
            "startOffset": 40,
            "endOffset": 78,
            "text": "olive dataset answers harbor question."
          }
        }
      ],
      "abstention": "none",
      "quarantine": [],
      "uncertainty": []
    },
    {
      "caseId": "dh4-006",
      "scenarioId": "dh4-s-006",
      "sourceDigest": "sha256:49ff4c3da1f850ff63455cbd38ead9f35169689bca4d7a601448d2cede37bda4",
      "entities": [
        {
          "occurrenceId": "dh4-006-e01",
          "type": "Task",
          "label": "Fallow task",
          "evidence": {
            "startOffset": 0,
            "endOffset": 11,
            "text": "Fallow task"
          }
        },
        {
          "occurrenceId": "dh4-006-e02",
          "type": "Control",
          "label": "silver control",
          "evidence": {
            "startOffset": 21,
            "endOffset": 35,
            "text": "silver control"
          }
        },
        {
          "occurrenceId": "dh4-006-e03",
          "type": "Resource",